{
  "_type": "https://in-toto.io/Statement/v1",
  "subject": [
    {
      "name": "trackai:repository/00000000-0000-4000-8000-000000000001/commit/9b8c7d6e5f4a3b2c1d0e9f8a7b6c5d4e3f2a1b0c",
      "digest": {
        "gitCommit": "9b8c7d6e5f4a3b2c1d0e9f8a7b6c5d4e3f2a1b0c"
      }
    }
  ],
  "predicateType": "https://trackai.dev/attesta/ai-provenance/v1",
  "predicate": {
    "statement_kind": "pr_merged",
    "as_of": "2026-10-12T11:02:40.007Z",
    "builder": {
      "name": "trackai-attesta-builder",
      "version": "0.1.0+88301f7"
    },
    "signed_late": {
      "value": false,
      "reason": "none"
    },
    "previous": [],
    "source_evidence": {
      "metric_event": {
        "availability": "unavailable",
        "reason": "not_applicable"
      },
      "provider_delivery": {
        "availability": "recorded",
        "value": {
          "provider": "github",
          "delivery_id": "5f1c0a2e-8b4d-11f0-9a1b-0242ac120002",
          "event_fingerprint": "8888888888888888888888888888888888888888888888888888888888888888",
          "received_at": "2026-10-12T11:02:31.950Z"
        }
      },
      "note_digest": {
        "availability": "unavailable",
        "reason": "source_missing"
      }
    },
    "first_seen": {
      "availability": "recorded",
      "value": {
        "at": "2026-10-12T11:02:31.950Z",
        "source": "github_push"
      }
    },
    "repository": {
      "id": "00000000-0000-4000-8000-000000000001",
      "provider": "github",
      "url_sha256": {
        "availability": "recorded",
        "value": "3333333333333333333333333333333333333333333333333333333333333333"
      }
    },
    "commit": {
      "sha": "9b8c7d6e5f4a3b2c1d0e9f8a7b6c5d4e3f2a1b0c",
      "operation_kind": {
        "availability": "unavailable",
        "reason": "source_missing"
      },
      "reachability": {
        "availability": "recorded",
        "value": "reachable"
      },
      "authored_at": {
        "availability": "unavailable",
        "reason": "source_missing"
      },
      "committed_at": {
        "availability": "unavailable",
        "reason": "source_missing"
      }
    },
    "lines": {
      "availability": "unavailable",
      "reason": "source_missing"
    },
    "files": {
      "availability": "unavailable",
      "reason": "source_missing"
    },
    "sessions": {
      "availability": "recorded",
      "value": [
        {
          "session_id": "00000000-0000-4000-8000-000000000030",
          "tool": "claude-code",
          "ai_lines": 432
        }
      ]
    },
    "models": {
      "availability": "recorded",
      "value": [
        {
          "tool": "claude-code",
          "model": "claude-sonnet-4-5",
          "model_key": "claude-code::claude-sonnet-4-5",
          "ai_lines": 432,
          "session_id": "00000000-0000-4000-8000-000000000030"
        }
      ]
    },
    "tools": {
      "availability": "recorded",
      "value": [
        "claude-code"
      ]
    },
    "committer": {
      "availability": "unavailable",
      "reason": "source_missing"
    },
    "lifecycle": {
      "availability": "partial",
      "partial_reason": "lineage_still_being_enriched",
      "value": {
        "stage": "merged",
        "ai_lines": 432,
        "calculation_version": {
          "availability": "unavailable",
          "reason": "not_captured_yet"
        }
      }
    },
    "pull_request": {
      "availability": "recorded",
      "value": {
        "id": "00000000-0000-4000-8000-000000000050",
        "provider": "github",
        "number": 42,
        "external_id": "2873461190",
        "state": "merged",
        "head_sha": "3f2a9c4e1b7d6a5f8e0c2b4d6f8a1c3e5b7d9f0a",
        "merge_commit_sha": "9b8c7d6e5f4a3b2c1d0e9f8a7b6c5d4e3f2a1b0c",
        "merged_at": "2026-10-12T11:02:30.000Z",
        "author_identity_id": {
          "availability": "recorded",
          "value": "00000000-0000-4000-8000-000000000060"
        }
      }
    },
    "merge_lineage": {
      "availability": "recorded",
      "value": [
        {
          "source_sha": "3f2a9c4e1b7d6a5f8e0c2b4d6f8a1c3e5b7d9f0a",
          "result_sha": "3f2a9c4e1b7d6a5f8e0c2b4d6f8a1c3e5b7d9f0a",
          "merge_method": "squash_merge",
          "confidence": 95,
          "source_statement_digest": "sha256:9999999999999999999999999999999999999999999999999999999999999999"
        }
      ]
    },
    "merged_by": {
      "availability": "unavailable",
      "reason": "not_captured_yet"
    },
    "reviews": {
      "availability": "unavailable",
      "reason": "not_captured_yet"
    },
    "deployment": {
      "availability": "unavailable",
      "reason": "not_applicable"
    },
    "policy": {
      "repository_enrollment": {
        "availability": "recorded",
        "value": {
          "id": "00000000-0000-4000-8000-000000000020",
          "status": "active",
          "effective_from": "2026-09-01T00:00:00.000Z",
          "effective_until": null,
          "commit_note_evidence_from": "2026-09-01T00:00:00.000Z"
        }
      },
      "security_monitor": {
        "availability": "recorded",
        "value": {
          "mode": "monitor",
          "version": 3
        }
      },
      "rule_pack_versions": {
        "availability": "partial",
        "partial_reason": "present_only_when_findings_exist",
        "value": [
          "2026.09.29"
        ]
      },
      "org_ai_policy": {
        "availability": "unavailable",
        "reason": "not_captured_yet"
      }
    },
    "security_findings_observed": {
      "availability": "recorded",
      "value": {
        "total": 0,
        "by_category": {},
        "by_severity": {}
      }
    },
    "repo_snapshot": {
      "availability": "unavailable",
      "reason": "not_captured_yet"
    }
  }
}
